"NOME_CANDIDATO","NOME_URNA_CANDIDATO","COD_GRAU_INSTRUCAO","CODIGO_ESTADO_CIVIL"
"ALDEMIR LOPES DA SILVA","ALDEMIR LOPES",8,1
"ANTONIA LUCILEIA CRUZ RAMOS CAMARA","ANTONIA LÚCIA",8,1
"BLANDINA MARIA DA SILVA E SILVA","BLANDINA SILVA",8,1
"CLAUDIO GASTAO KIPPER","KIPPER",8,1
"CELIO TEIXEIRA DE SOUZA","CÉLIO TEIXEIRA",6,1
"DEODATO NUNES DE FRANCA","DEODATO",8,1
"EDILBERTO AFONSO DE MORAIS JUNIOR","JÚNIOR BETÃO",6,1
"FERNANDO MELO DA COSTA","FERNANDO MELO",8,1
"FLAVIANO FLAVIO BAPTISTA DE MELO","FLAVIANO MELO",8,1
"FRANCISCO HAMILTON D'AVILA LUCENA","HAMILTON LUCENA",6,1
"FRANCISCO ROBERTO RODRIGUES MARTINS","SARGENTO MARTINS",7,1
"GILDOMAR OLIVEIRA GOMES","CHARQUEIRO",6,1
"GLADSON DE LIMA CAMELI","GLADSON CAMELI",8,1
"ILDERLEI SOUZA RODRIGUES CORDEIRO","ILDERLEI CORDEIRO",7,1
"JESUS RODRIGUES DA SILVA","IRMÃO JESUS",6,1
"JONAS VELASQUES FELICIO","JONAS FELICIO",5,1
"JOSE IVANILSON NERI GUEDES","GUEDES",6,1
"JOSE RAIMUNDO BARROZO BESTENE","BESTENE",7,1
"JOSE AFONSO GEBER","PASTOR AFONSO GEBER",6,1
"JOSE BRAZ ALVES PEDROZA","BRAZ (DA MEGA DATA)",8,1
"JOSE MARQUES LEITE NETO","MIRABOR LEITE",6,1
"JOAO ANTONIO RODRIGUES BRONZEADO","ZICO BRONZEADO",7,1
"JOAO CORREIA LIMA SOBRINHO","JOÃO CORREIA",8,1
"JOAO TOTA SOARES DE FIGUEIREDO","JOÃO TOTA",8,1
"LUCILA BRUNETTA","LUCILA",8,1
"MARIA PERPETUA ALMEIDA","PERPÉTUA",6,1
"NARCISO MENDES DE ASSIS","NARCISO MENDES",8,1
"NAZARE FERNANDES DA SILVA","NAZARÉ FERNANDES",8,1
"NILSON MOURA LEITE MOURAO","NILSON MOURÃO",8,1
"NORMANDO RODRIGUES SALES","NORMANDO SALES",8,1
"ROBERTO BARROS JUNIOR","BEBETO JUNIOR",8,1
"SERGIO DE OLIVEIRA CUNHA","PETECÃO",6,1
"SONIA MARIA ALVES TAMBORINI","SÔNIA TAMBORINI",8,1
"WALDY ROCHA DE CARVALHO FILHO","VAVÁ",8,1
"ADALBERTO TEIXEIRA ROCHA JUNIOR","CICINHO DA CAIXA",7,1
"ALEX FERNANDES DOS SANTOS","ALEX FERNANDES",5,1
"ANTONIO CARLOS RAMOS","CHAMARIZ",4,1
"ANTONIO FERREIRA DE ANDRADE","ANTONIO FERREIRA",3,1
"AUGUSTO CESAR CAVALCANTE FARIAS","AUGUSTO FARIAS",8,1
"BENEDITO DE LIRA","BENEDITO DE LIRA",8,1
"CARLOS ANDRE CAVALCANTI FERREIRA","CARLOS ANDRÉ O POETA",7,1
"CARLOS AVELINO DA SILVA FILHO","CARLOS AVELINO",8,1
"CARLOS EDUARDO AFFONSO DE MELLO","KAKÁ",8,1
"CLIUTON SANTOS","CLIUTON SANTOS",6,1
"CREUVANSOSTENES MONTEIRO FERREIRA","ZORTE LINS",6,1
"CRISTIANO MATHEUS DA SILVA E SOUSA","CRISTIANO MATHEUS",8,1
"CICERO MENDONCA DE LIMA","CÍCERO MENDONÇA",4,1
"DELIO JOSE DE SOUZA ALMEIDA","DÉLIO ALMEIDA",8,1
"EDLENE FERREIRA LIMA","EDLENE FERREIRA",8,1
"FRANCISCO DE SOUZA IRMAO","CHICO DA CAPIAL",6,1
"GEORGE SAMUEL SANGUINETTI FELLOWS","SANGUINETTI",8,1
"GERONIMO CIQUEIRA DA SILVA","GERÔNIMO DA ADEFAL",6,1
"GIVALDO DE SA GOUVEIA CARIMBAO","GIVALDO CARIMBÃO",3,1
"HETH CESAR BISMARCK ATHAYDE BARBOSA DE OLIVEIRA","HETH CÉSAR",8,1
"ILDO RAFAEL","ILDO RAFAEL",8,1
"JOAQUIM BELTRAO SIQUEIRA","JAOQUIM BELTRÃO",8,1
"JOSE FRANCISCO DE LIMA","CHICO LIMA",3,1
"JOSE HELENILDO RIBEIRO MONTEIRO","HELENILDO RIBEIRO",8,1
"JOSE JOAQUIM BARROS VIEIRA SANDES","JOAQUIM SANDES",8,1
"JOSE JUNIOR DE MELO","JÚNIOR LEÃO",8,1
"JOSE MARINHO MUNIZ FALCAO","ZÉ MUNIZ",6,1
"JOSE REGIS BARROS CAVALCANTE","REGIS CAVALCANTE",8,1
"JOSE ROBERTO SILVA","BETTO SOM",6,1
"JOAO EUDES FERREIRA CAVALCANTE","JOÃO EUDES",6,1
"JURANDIR BOIA ROCHA","JURANDIR BOIA",8,1
"KATIA BORN RIBEIRO","KÁTIA BORN",8,1
"LUIZ EUSTAQUIO TOLEDO FILHO","LUIZ FILHO",7,1
"MARCELO ZACARIAS DE OLIVEIRA","MARCELO ZACARIAS SAPÃO",6,1
"MARCOS ANTONIO VIEIRA DA SILVA","MARCOS VIEIRA",8,1
"MICHELINE VILELA TOLEDO","MICHELINE VILELA TOLEDO",7,1
"OLAVO CALHEIROS FILHO","OLAVO",8,1
"ROGERIO AUTO TEOFILO","ROGÉRIO TEÓFILO",8,1
"RONALDO LUZ","DR. RONALDO LUZ",8,1
"SANDRA DO CARMO DE MENEZES","SANDRA MENEZES",8,1
"TARCISIO SAMPAIO FREIRE","TARCÍSIO FREIRE",8,1
"VALTER GOMES DA SILVA","MANO",6,1
"VENANCIO DOS ANJOS TELES","PALHAÇO PIRULITO",3,1
"ITALO SUARUAGY DO AMARAL","ÍTALO AMARAL",8,1
"ALMIR FILGUEIRAS FONSECA","DR. ALMIR",8,1
"ALTAIR VIEIRA RODRIGUES","ALTAIR VIEIRA",6,1
"ANTONIO EDERVAL DE LIMA","EDERVAL",8,1
"ANTONIO JOSE LEOPOLDINO MATOS ARANTES","SGT.ARANTES",6,1
"ANTONIO MENEZES","CABO MENEZES",8,1
"ARI JORGE MOUTINHO DA COSTA JUNIOR","ARI MOUTINHO",8,1
"ATILA SIDNEY LINS ALBUQUERQUE","ATILA LINS",8,1
"BERILO BERNARDINO DE OLIVEIRA","MAJOR BERILO",8,1
"CARLOS ALBERTO CAVALCANTE DE SOUZA","CARLOS SOUZA",8,1
"CUSTODIO DE OLIVEIRA BEDIDO","CUSTODIO BEDIDO",6,1
"DARCY HUMBERTO MICHILES","HUMBERTO MICHILES",7,1
"DAVIS TORRES DE ARAUJO","SGT.DAVIS",8,1
"EMMANUEL MACHADO PINHEIRO SALAZAR","DR. SALAZAR",8,1
"ERNESTO NUNES DA COSTA","DR. ERNESTO",8,1
"FRANCISCO DE ASSIS DA CRUZ GOMES","IRMÃO ASSIS",4,1
"FRANCISCO EDNALDO PRACIANO","PRACIANO",8,1
"FRANCISCO GOMES DE OLIVEIRA","DR CHICÃO",8,1
"IRANILDO MOREIRA DE SOUZA","IRANILDO SOUZA",6,1
"JANILSON LUIZ MENDES PEREIRA","JANILSON MENDES",6,1
"JOAO WELLINGTON DE MEDEIROS CURSINO","TONY MEDEIROS",8,1
"JOSE APARECIDO DOS SANTOS","APARECIDO",8,1
"JOSE FERNANDO LOBATO","DR LOBATO",8,1
"JOSE MELO DA SILVA SOBRINHO","JOSE MELO",6,1
"JOSE ADILSON VIEIRA DE JESUS","ADILSON",7,1
"JOSE LUPERCIO RAMOS DE OLIVEIRA","LUPÉRCIO RAMOS",8,1
"LADISLON ARAUJO DIRANE","CARECA",7,1
"LUIZ FERNANDO SARMENTO NICOLAU","DR. LUIZ FERNANDO",8,1
"LUIZ PEREIRA MELO DE SOUZA","LUIZINHO MELO",3,1
"MARCELO AUGUSTO DA EIRA CORREA","MARCELO SERAFIM",8,1
"MIGUEL CAPOBIANGO NETO","MIGUEL BIANGO",8,1
"NELSON CAVALCANTE CAMPOS","NELSINHO",7,1
"NORMELIA SERRAO MENDONCA","NORMÉLIA SERRÃO",4,1
"PAULO FRANCISCO DUTRA CHAVES","CORONEL DUTRA",8,1
"PAULO HERBAN MACIEL JACOB FILHO","PAULO JACOB",8,1
"PEDRO GARCIA","PEDRO GARCIA",6,1
"RAIMUNDO ORLEANS DA CONCEICAO DE ALMEIDA NEVES","CAPITAO ORLEANS",8,1
"RAIMUNDO SABINO CASTELO BRANCO MAUES","SABINO CASTELO BRANCO",6,1
"ROBERTO CARLOS RIBEIRO PEREIRA","ROBERTO CARLOS",6,1
"RONALDO DE BRITO LEITE","RONALDO LEITE",8,1
"SILAS CAMARA","SILAS CAMARA",8,1
"SOLANE DE FATIMA PEREIRA CARVALHO","SOL",6,1
"VANESSA GRAZZIOTIN","VANESSA",8,1
"ALLAN ROSAS SALES","ALLAN SALES",6,1
"AMAURI DE SOUZA BARROS","AMAURI BARROS",6,1
"ANTONIO DA JUSTA FEIJAO","FEIJAO",8,1
"ARMANDO ALVES JUNIOR","CORONEL ALVES",8,1
"BENEDITO DIAS DE CARVALHO","DR. BENEDITO DIAS",8,1
"CLAUDIO PINHO SANTANA","CLAUDIO PINHO 4013",8,1
"CONCEICAO CORREA MEDEIROS","CONCEIÇÃO MEDEIROS",8,1
"CELIO UBIRAJARA ARAUJO DIAS","JARA",8,1
"EDILSON VEIRA ROCHA","ROCHA DO SUCATÃO",6,1
"EDIMILSOM DE JESUS TEIXEIRA","TONY",3,1
"EDUARDO SEABRA DA COSTA","EDUARDO SEABRA",8,1
"ELIANE GONCALVES","ELIANE",8,1
"ELIEL TENORIO SOARES","TENORIO",8,1
"ERALDO DA SILVA TRINDADE","ERALDO TRINDADE",7,1
"FERNANDO ANTONIO DE FARIAS AIRES","DR. FERNANDO",8,1
"FATIMA LUCIA PELAES","FÁTIMA PELAES",8,1
"GERALDO DE JESUS CAPELA DE ARAUJO","GERALDO CAPELA 4080",8,1
"GERVASIO AUGUSTO DE OLIVEIRA","GERVÁSIO OIVEIRA",8,1
"HELIO BORGES DE SOUSA ESTEVES FILHO","HELIO ESTEVES",8,1
"HILDEMAR SOUZA DE AZEVEDO PICANCO","BADU PICANÇO",8,1
"ISAAC SILVA GOMES","ISAAC SILVA",6,1
"JANETE MARIA GOES CAPIBERIBE","JANETE 4040",7,1
"JESAIAS SILVA E SILVA","JEZA",4,1
"JONAS PINHEIRO BORGES","JONAS PINHEIRO",8,1
"JORGE ELIAS CASTRO","ELIAS",8,1
"JOSE CARLOS MAGALHAES BARROSO","PASTOR CARLOS BEIRAO",5,1
"JOSE CHAGAS ALVES","DR. CHAGAS",8,1
"JOSE LUIZ DA SILVA FERREIRA","JOSÉ LUIZ",6,1
"JOSUE BATISTA DA COSTA","JOSUE COSTA",5,1
"JOSE ALMIR DE FREITAS","ALMIR",4,1
"JOSE LUIZ NOGUEIRA DE SOUSA","ZÉ LUIZ",6,1
"JOSE RAIMUNDO COUTINHO PEREIRA","COUTINHO",8,1
"JOAO NASCIMENTO BORGES FILHO","JOÃO BORGES",8,1
"LEIVO RODRIGUES DOS SANTOS","PROFº LEIVO RODRIGUES 4023",8,1
"LEONIL DE AQUINO PENA AMANAJAS","PROFESSOR LEONIL AMANAJÁS",8,1
"LUIZ CARLOS DE CAMARGO","PROF. LUIZ 4010",8,1
"LUCIO ADELSON DE SOUSA MENDES","TEN. ADELSON 4090",7,1
"MAIR PAULA RODRIGUES","MAIR DE PAULA",6,1
"MARIA DALVA DE SOUZA FIGUEIREDO","PROFª DALVA",8,1
"MARIA LUCENIRA FERREIRA OLIVEIRA PIMENTEL","LUCENIRA PIMENTEL",8,1
"MARINALVA DE SENA GOMES","NALVA GOMES 4004",6,1
"MAURA RODRIGUES LIMA","MAURA RODRIGUES",4,1
"MESSIAS REIS DA SILVA","MESSIAS",6,1
"MOACIR DE ARAUJO ALMEIDA JUNIOR","ALMEIDA JUNIOR",8,1
"MARCIO ALESSANDRO FLEXA DE OLIVEIRA","ALESSANDRO SABINO",6,1
"RAIMUNDO AMERICO FURTADO DE MIRANDA","MIRANDA 4009",8,1
"REINALDO MACEDO DA SILVA","REI",8,1
"RIVADAVIA MIGUEL DE SOUZA FRANCA","MIGUEL FRANÇA",6,1
"SANZIO JOSE LEAL CUNHA","SANZIO 4022",6,1
"SEBASTIAO FERREIRA DA ROCHA","BALA",8,1
"VALDENOR GUEDES SOARES","VALDENOR GUEDES",8,1
"VALTER RUBEN VANDER LINDEN VIEIRA","VALTER VIEIRA",8,1
"WALDEIR GARCIA RIBEIRO","WALDEIR",8,1
"WALFREDO WILSON DAS NEVES","WALFREDO DAS NEVES",8,1
"ADALBERTO LELIS FILHO","BETO LELIS",4,1
"ADELMO ALMEIDA DE MENEZES","ADELMO",7,1
"ALEXANDRE PEREIRA DE SOUSA","ALEXANDRE",7,1
"ALICE MAZZUCO PORTUGAL","ALICE PORTUGAL",8,1
"AMARO DOS SANTOS FILHO","MARINHO",3,1
"AMERICO MAIA PEREIRA RODRIGUES","AMÉRICO MAIA",6,1
"ANTONIO ALBERTO MACHADO MAGALHAES","ANTONIO MAGALHAES",8,1
"ANTONIO CARLOS FREIRE PINHEIRO","NENO PINHEIRO",7,1
"ANTONIO CARLOS SOUZA MOTA","ANTONIO C. MOTA",6,1
"ANTONIO FERNANDO XAVIER DOS SANTOS","ARANHA",7,1
"ANTONIO HENRIQUE DE AGUIAR CARDOSO","HENRIQUE AGUIAR",8,1
"ANTONIO JOSE PICOLE DE OLIVEIRA","PICOLÉ",8,1
"ANTONIO JOSE CARNEIRO LOPES","BUBU PÉ DE SERRA",7,1
"ANTONIA MAGALHAES DA CRUZ","TONHA MAGALHÃES",6,1
"ANTONIO CARLOS PEIXOTO DE MAGALHAES NETO","ACM NETO",8,1
"ARNALDO ANTONIO FERNANDEZ","ARNALDO FERNANDEZ",6,1
"ARNALDO DE SANTANA NEVES","ARNALDO SANTANA NEVES",7,1
"AROLDO CEDRAZ DE OLIVEIRA","AROLDO CEDRAZ",8,1
"ARQUIMEDES GOMES DOS SANTOS","ARQUIMEDES SANTOS",8,1
"BASILIO ANDARAHY DOS SANTOS","IRMÃO BASILIO",4,1
"BENITO DA GAMA SANTOS","BENITO GAMA",8,1
"BRAULIO MENDONCA CARDOSO","BRAULIO CARDOSO",6,1
"CARLITO FERREIRA PEREIRA DOS SANTOS","CARLITO FERREIRA",7,1
"CARLOS HENRIQUE ALVES MARTINEZ","PROF. DR. MARTINEZ",8,1
"CLAUDIA MARIA MARTINS DA SILVA","CLAUDIA MARIA",8,1
"CLAUDIO CAJADO SAMPAIO","CLAUDIO CAJADO",8,1
"CLAUDIO FIDEL MAXIMO MOREIRA","CLAUDIO FIDEL",8,1
"COLBERT MARTINS DA SILVA FILHO","COLBERT MARTINS",8,1
"CRISTIANE ALMEIDA SANTOS","CRISTIANE SANTOS",6,1
"CASSIO SANTOS MACHADO","CÁSSIO MACHADO",8,1
"DANIEL GOMES DE ALMEIDA","DANIEL",6,1
"DILTON GOIS DOS SANTOS","DILTON GOIS",4,1
"DJALMA DOS SANTOS GOMES","DJALMA GOMES",8,1
"DOMINGOS EVANGELISTA DOS SANTOS","DOMINGOS EVANGELISTA",6,1
"DOMINGOS PEREIRA DA SILVA","DOMINGOS PEREIRA",7,1
"EDELTONIO LIBERATO DOS SANTOS","LIBERATO",8,1
"EDIGAR EVANGELISTA DOS ANJOS","EDIGAR MÃO BRANCA",3,1
"EDIVALDO PINTO DE SOUZA","EDIVALDO PINTO",6,1
"EDSON JORGE NEMI","EDSON NEMI",8,1
"EDSON LUIZ RAMOS DANTAS","EDSON DANTAS",8,1
"EDSON PEREIRA DE OLIVEIRA","EDSON PEREIRA OLIVEIRA",8,1
"EDVALDO JOSE ABREU","EDVALDO ABREU",6,1
"ELIAS MATHIAS DOS SANTOS","ELIAS BRANCO",4,1
"ELIONALDO DE FARO TELES","ELIONALDO",8,1
"EMILIANO JOSE DA SILVA FILHO","EMILIANO JOSE",8,1
"ERIVELTON LIMA SANTANA","ERIVELTON SANTANA",7,1
"ETELVINO DIONISIO BISPO NETO","ETELVINO NETO",6,1
"EUJACIO SIMOES VIANA FILHO","EUJACIO",8,1
"EXPEDITO DA SILVA BARBOSA","PROFº EXPEDITO",8,1
"FELIX DE ALMEIDA MENDONCA","FELIX MENDONÇA",8,1
"FERNANDO LUCIO CARNEIRO","FERNANDO CARNEIRO",8,1
"FRANCISCO GONCALVES ALMEIDA","FRANCISCO IRMÃO",6,1
"FABIO LOUREIRO SOUTO","FÁBIO SOUTO",8,1
"FELIX DE ALMEIDA MENDONCA JUNIOR","FÉLIX JUNIOR",8,1
"GEDDEL QUADROS VIEIRA LIMA","GEDDEL",8,1
"GENIVALDO SANTOS MELO","GENI MELO",6,1
"GERALDO JOSE PIRES","GERALDO PIRES",6,1
"GERALDO SIMOES DE OLIVEIRA","GERALDO SIMOES",8,1
"GERSON SILVA GABRIELLI","GABRIELLI",8,1
"GILDASIO MENDES DE ANDRADE","GILDASIO ANDRADE",8,1
"GILDSON GOMES DOS SANTOS","ADVOGADO GOMES",8,1
"GILZETE DA SILVA MOREIRA","GILZETE",6,1
"GUILHERME MENEZES DE ANDRADE","GUILHERME MENEZES",8,1
"HANS GUERRIERI SCHLEIER","HANS",7,1
"IVO DOURADO DA MOTA","IVO DOURADO",6,1
"JAIR CARDOSO DOS SANTOS","JAIR CARDOSO",8,1
"JAIRO ALFREDO OLIVEIRA CARNEIRO","JAIRO CARNEIRO",8,1
"JAIRO ALVES LIMA","JAIRO LIMA",6,1
"JEANE ALVES CRUZ MORAIS","PROFESSORA JEANE",8,1
"JOAQUIM APOLINARIO DE SOUSA","JOAQUIM APOLINARIO",6,1
"JOAQUIM QUINTILIANO DA FONSECA JUNIOR","JOAQUIM FONSECA",8,1
"JONIVAL LUCAS DA SILVA JUNIOR","JONIVAL LUCAS",8,1
"JORGE EDUARDO DE SCHOUCAIR JAMBEIRO","JORGE JAMBEIRO",8,1
"JORGE KHOURY HEDAYE","JORGE KHOURY",8,1
"JORGE LUIS ARAUJO COSTA","JOTA ÉLE",6,1
"JOSE CARLOS LEAO DE ARAUJO","JOSÉ CARLOS ARAÚJO",7,1
"JOSE EDUARDO VIEIRA RIBEIRO","ZEZEU",8,1
"JOSE GONZAGA DA SILVA","GONZAGA",6,1
"JOSE RAIMUNDO DA SILVA","ZÉ DO LÍCIO",3,1
"JOSE RAIMUNDO SAMPAIO OLIVEIRA","ZÉ RAIMUNDO",7,1
"JOSEPH WALLACE FARIA BANDEIRA","JOSEPH BANDEIRA",8,1
"JOSIAS GOMES DA SILVA","JOSIAS GOMES",8,1
"JOSE ALMEIDA ROCHA","ALMEIDA ROCHA",6,1
"JOSE ALVES ROCHA","JOSÉ ROCHA",8,1
"JOSE ALVES SECUNDO","PROFESSOR JOSÉ ALVES SECUNDO",8,1
"JOSE BARBOSA FILHO","BARBOSA",8,1
"JOSE CARLOS ALELUIA COSTA","ALELUIA",8,1
"JOSE CARLOS BRITO LACERDA","CARLOS LACERDA",8,1
"JOSE CARLOS DE JESUS RODRIGUES","ZÉ CARLOS DA PESCA",6,1
"JOSE DE SOUZA LEITE","ZÉ LEITE",6,1
"JOSE FRANCISCO DA SILVA","TIO DEDÉ",8,1
"JOSE MALTA MAIA","ZÉ MAIA",8,1
"JOAO FELIPE DE SOUZA LEAO","JOÃO LEÃO",4,1
"JUSCELINO PEREIRA SAMPAIO","JUSCELINO SAMPAIO",7,1
"JUSCELIO DE SOUZA CARMO","JUSCELIO CARMO",7,1
"JUSMARI TEREZINHA DE SOUZA OLIVEIRA","JUSMARI OLIVEIRA",8,1
"JUTAHY MAGALHAES JUNIOR","JUTAHY",8,1
"LOURIVAL MANOEL DO BONFIM","LOURIVAL COMPANHEIRO",6,1
"LUIZ ALBERTO SILVA DOS SANTOS","LUIZ ALBERTO",8,1
"LUIZ ANTONIO VASCONCELLOS CARREIRA","LUIZ CARREIRA",8,1
"LUIZ CARLOS BARROS DA SILVA","LULA BARROS",8,1
"LUIZ CARLOS BASSUMA","BASSUMA",8,1
"LUIZ FERNANDO DE FABINHO ARAUJO LIMA","FERNANDO DE FABINHO",8,1
"LUIZ HENRIQUE AZEVEDO FORTUNATO","LUIZ HENRIQUE FORTUNATO",6,1
"LUIZ HUMBERTO PRISCO VIANA","PRISCO VIANA",6,1
"LIDICE DA MATA E SOUZA","LÍDICE DA MATA",8,1
"MANOEL ISIDORIO DE SANTANA JUNIOR","SARGENTO ISIDÓRIO",6,1
"MANUEL AZEVEDO ROCHA","MANUEL ROCHA",7,1
"MARCELINO JOSE GUIMARAES SANTANA","MARCELO SANTANA",8,1
"MARCELO DE OLIVEIRA GUIMARAES FILHO","MARCELO GUIMARÃES FILHO",8,1
"MARCIO CARLOS MARINHO","MARCIO MARINHO",7,1
"MARCOS CESAR ALVES SOUTO","MARCOS SOUTO",7,1
"MARIA AUXILIADORA CUNHA CERQUEIRA","PROFESSORA DORA",8,1
"MARIA JOSE GARCIA","MARIAH",7,1
"MARIA OLIVIA SANTANA","OLÍVIA",8,1
"MAURICIO GONCALVES TRINDADE","MAURICIO TRINDADE",8,1
"MESSIAS APARECIDO RODRIGUES","MESSIAS APARECIDO",8,1
"MILTON JOAO SOARES BARBOSA","MILTON BARBOSA",7,1
"MARIO SERGIO DE ARAUJO","MARIO SERGIO",6,1
"MARIO SILVIO MENDES NEGROMONTE","MÁRIO NEGROMONTE",8,1
"NEEMIAS DA COSTA GONCALVES","NEEMIAS GONÇALVES",6,1
"NELSON VICENTE PORTELA PELLEGRINO","PELEGRINO",8,1
"NILZA DA SILVA MARTINS DE LIMA","PROFª NILZA LIMA",6,1
"NIVALDO TEIXEIRA LIMA FILHO","NIVALDO TEIXEIRA",6,1
"NOELSON VIEIRA NUNES","NOEL",4,1
"ONEZILDA MARIA LIMA SORIANO","ZILDA SORIANO",8,1
"OSSESIO JOSE DA SILVA","OSSÉSIO SILVA",6,1
"OTAVIO JOEL DE ARAUJO","SARGENTO JOEL",8,1
"OZEIAS GOMES DA COSTA","OZÉIAS GOMES",8,1
"PAULO BRAGA MIRANDA","PAULO BRAGA",6,1
"PAULO ROBERTO COSTA FEITOSA","PAULO FEITOSA",8,1
"PAULO SERGIO PARANHOS DE MAGALHAES","PAULO MAGALHAES",8,1
"PAULO SERGIO MACEDO LOPES","PAULO SERGIO",4,1
"PEDRO MARCELINO PINTO NETO","PEDRO MARCELINO",6,1
"RAIMUNDO AMARAL AMPARO","AMPARO",5,1
"RANIERI CARVALHO","RANIERI CARVALHO",8,1
"RAYMUNDO VELOSO SILVA","VELOSO",8,1
"REGINALDO DA SILVA GERMANO","PASTOR REGINALDO",7,1
"REINALDO FERREIRA LIMA DE SOUZA","REINALDO LIMA",6,1
"RICARDO EMANUEL LAGO E SILVA","RICARDO EMANUEL",8,1
"RICARDO GREY DE ARAUJO LEMOS","RICARDO GREY",7,1
"RICARDO MORAIS BRITO","RICARDO BOMTRIGO",7,1
"ROBERTO PEREIRA DE BRITTO","ROBERTO BRITTO",8,1
"ROBERTO RAMOS","RAMOS",6,1
"ROMILSON NERY BISPO","ROMILSON BISPO",6,1
"ROMILSON SANTOS DE SOUZA FILHO","ROMILSON SANTOS",7,1
"RUBENS ANTONIO CORREIA","RUBENS CORREIA",6,1
"RUI COSTA DOS SANTOS","RUI COSTA",8,1
"RUI MAGNO DE CARVALHO","RUI MAGNO",8,1
"SALVADOR PEREIRA DE SOUZA","SALVADOR ROGER",4,1
"SERGIO BARRADAS CARNEIRO","SERGIO BARRADAS CARNEIRO",8,1
"SERGIO LUIS LACERDA BRITO","SERGIO BRITO",7,1
"SERGIO RAIMUNDO DE OLIVEIRA RIBEIRO","SERGIO RIBEIRO",8,1
"SEVERIANO ALVES DE SOUZA","SEVERIANO ALVES",8,1
"TADEU RIBEIRO SANCHES","TADEU SANSHES",6,1
"UBIRAJARA TAVARES GOMES DOS SANTOS","BIRA DO JEGUE",3,1
"ULDURICO ALVES PINTO","ULDURICO PINTO",8,1
"VALDEMIRO DA ANUNCIACAO SANTOS LOPES","VALDEMIRO",6,1
"VALFREDO RAMOS RIOS","VALFREDO",6,1
"VANIA DE ALMEIDA SANTOS","VÂNIA SANTOS",6,1
"WALTER DE FREITAS PINHEIRO","PINHEIRO",8,1
"WALTER FERREIRA DA SILVA","WALTER FERREIRA",6,1
"WASHINGTON FERREIRA DOS SANTOS","WASHINGTON FERREIRA",8,1
"WASHINGTON PINTO CARDOSO","WASHINGTON",6,1
"WELLINGTON FONSECA RIBEIRO","WELLINGTON RIBEIRO",8,1
"ALEXANDRE CAMPELO BORGES","ALEXANDRE BORGES",8,1
"ANDRE BARRETO ESMERALDO","ANDRE BARRETO",8,1
"ANDRE PEIXOTO FIGUEIREDO LIMA","ANDRÉ FIGUEIREDO",8,1
"ANTERO NETO SILVA","ANTERO SILVA NETO",8,1
"ANTONIA CORDEIRO CUNHA","ANTONIA CORDEIRO",8,1
"ANTONIO ATILANO SOUSA AYRES DE MOURA","ATILANO",8,1
"ANTONIO CLECIO BATISTA DE OLIVEIRA","CLÉCIO OLIVEIRA",8,1
"ANTONIO COSTA SILVA","TOINHO",6,1
"ANTONIO FERREIRA DA SILVA","FERREIRINHA",4,1
"ANTONIO MANOEL DA COSTA","BARÉ",3,1
"ANTONIO MARCELO TEIXEIRA SOUSA","MARCELO",8,1
"ANTONIO PEREIRA DOS SANTOS","ARY",8,1
"ANTONIO XAVIER DE OLIVEIRA","DR. XAVIER",8,1
"ANIBAL FERREIRA GOMES","ANÍBAL",8,1
"ARISTIDES BRAGA NETO","PROF. ARISTIDES",8,1
"AECIO CARLOS GUNDIM SILVA","AÉCIO GUNDIM",7,1
"BERNARDINO JOSE INACIO LOPES","BERNARDINO",8,1
"BISMARCK COSTA LIMA PINHEIRO MAIA","BISMARCK MAIA",7,1
"CARLOS MATOS LIMA","CARLOS MATOS",8,1
"CARLOS MAURO CABRAL BENEVIDES","MAURO BENEVIDES",8,1
"CIRO FERREIRA GOMES","CIRO GOMES",8,1
"CRISTIANO SOUZA FERREIRA","CRISTIANO PAPEL",7,1
"CANDIDO BEZERRA DA COSTA NETO","BC NETO",8,1
"DALTON LACERDA VIDAL VITAL","DALTON VIDAL",8,1
"DARLAN DE OLIVEIRA REIS JUNIOR","PROFESSOR DARLAN",8,1
"DELADIER FEITOSA MARIZ","CORONEL DELADIER",8,1
"DURVAL THOMAZ DE SOUZA","DURVAL THOMAZ",4,1
"EDMAR BESERRA GRANJA","DEL. EDMAR GRANJA",8,1
"EDUARDO MARTINS BARBOSA","EDUARDO BARBOSA",8,1
"ELPIDIO LUIZ PEREIRA NETO","ELPIDIO LUIZ",8,1
"EMMANUEL MACHADO BARROS","EMMANUEL MACHADO BARROS",7,1
"EUGENIO RABELO","EUGÊNIO RABELO",6,1
"EUNICIO LOPES DE OLIVEIRA","EUNÍCIO",8,1
"FLAVIO BEZERRA DA SILVA","FLÁVIO BEZERRA",8,1
"FRANCISCO ALMINO LEITE DE MENEZES","ALMINO MENEZES",8,1
"FRANCISCO ANTONIO GIRLANDO AIRES RODRIGUES","GIRLANO RODRIGUES",6,1
"FRANCISCO ARIOSTO HOLANDA","ARIOSTO HOLANDA",8,1
"FRANCISCO CLAUDIO PINTO PINHO","CLÁUDIO PINHO",8,1
"FRANCISCO EVANDO DELFINO MOREIRA","EVANDO MOREIRA",7,1
"FRANCISCO JANIR DE SOUSA","JANIR",6,1
"FRANCISCO LOPES DA SILVA","CHICO LOPES",8,1
"FRANCISCO MELO DOS SANTOS","CHIQUINHO DA VILA",8,1
"FRANCISCO RUBENS FREITAS SOUZA","RUBENS FREITAS",6,1
"FRANCISCO SOLISMAR LOPES DE ARAUJO","SOLISMAR",4,1
"GUMERCINDO TOURINHO FILHO","TOURINHO FILHO",8,1
"HAILTON PAULA DA SILVA","HAILTON",6,1
"JOAO DA CRUZ SILVA","JOÃO DA CRUZ",8,1
"JOAO DE SOUZA XAVIER","JOAO CARTEIRO",6,1
"JOSE ALRI RODRIGUES NOGUEIRA","ALRI NOGUEIRA",8,1
"JOSE ARNON CRUZ BEZERRA DE MENEZES","ARNON BEZERRA",8,1
"JOSE GARCIA FERNANDES","ZE MARIA DA FOTO",6,1
"JOSE JAIRO ARAUJO","JOSE JAIRO",4,1
"JOSE LEORNE NOGUEIRA","PROFESSOR LEORNE NOGUEIRA",8,1
"JOSE MARIA PIMENTA LIMA","ZEMARIA PIMENTA",8,1
"JOSE RIBAMAR AGUIAR JUNIOR","AGUIAR JÚNIOR",8,1
"JOSE SALOMAO BARBOSA CIRIACO","SALOMAO CIRIACO",6,1
"JOSE AIRTON FELIX CIRILO DA SILVA","JOSÉ AIRTON",8,1
"JOSE BARROSO PIMENTEL","PIMENTEL",8,1
"JOSE CARLOS VENERANDA DA SILVA","CARLOS VENERANDA",7,1
"JOSE GERARDO OLIVEIRA DE ARRUDA FILHO","ZÉ GERARDO",6,1
"JOSE NOBRE GUIMARAES","GUIMARÃES",8,1
"JOSE ORLANDO SAMPAIO","ZÉ ORLANDO",7,1
"JOSE RENATO FERREIRA TORRANO","RENATO TORRANO",8,1
"JOSE RUBENS MONTEIRO BRASIL","RUBENS BRASIL",8,1
"JOAO BARBOSA PINHEIRO SOBRINHO","JOÃO PINHEIRO",8,1
"JOAO BOSCO PAZ REBOUCAS","JOÃO BOSCO",6,1
"JOAO CARLOS AUGUSTO MELO MOREIRA","JOÃO CARLOS",8,1
"JULIO AUGUSTO GURGEL ALVES","DR. JÚLIO",8,1
"JURACI VEIRA DE MAGALHAES","JURACI",8,1
"LEILSON BORGES DA SILVA","LEILSON BORGES",4,1
"LEONARDO ROSARIO DE ALCANTARA","LEO ALCÂNTARA",8,1
"LUIS ACACIO SOUSA JUNIOR","ACACIO JUNIOR",8,1
"LUIS JOSE BATISTA DA SILVA","LUIS JOSE",4,1
"LUIZ DE GONZAGA FONSECA MOTA","GONZAGA MOTA",8,1
"MANOEL BEEL DE OLIVEIRA","BEEL",6,1
"MANOEL PEDRO FILHO","PEDIM",4,1
"MANOEL RAIMUNDO DE SANTANA NETO","DR. SANTANA",8,1
"MANUEL NUNES DO CARMO","MANUEL NUNES",6,1
"MARCO ANTONIO BARROSO PRADO","MARCO PRADO",8,1
"MARIA APARECIDA PEREIRA DE ALBUQUERQUE","CIDA",8,1
"MARIA AURELENA DA SILVEIRA CARNEIRO","LENA",5,1
"MARIA CRERINEUMA DE OLIVEIRA SILVA","CLERYNEUMA",6,1
"MARIA DE JESUS CARNEIRO","JESUS",5,1
"MARIA GORETE PEREIRA","GORETE PEREIRA",8,1
"MARIA JANI DA COSTA","JANI COSTA",4,1
"MARIA JOSE CHAVES DE MORAIS","ZEZÉ MORAIS",8,1
"MARIA ZELIA SALES MESQUITA","ZÉLIA MESQUITAS",4,1
"MARINILSON PEREIRA DOS SANTOS","SOLDADO MARINILSON",4,1
"MARK DE ALBUQUERQUE VIANA","MARK VIANA",8,1
"MARIO MAMEDE FILHO","MÁRIO MAMEDE",8,1
"PAULO BARRETO RIBEIRO MINDELLO","PAULO MINDÊLLO",8,1
"PAULO HENRIQUE ELLERY LUSTOSA DA COSTA","PAULO HENRIQUE LUSTOSA",8,1
"PAULO ROBERTO DOURADO ARRUDA","PAULO DOURADO",6,1
"PEDRO IDELANO DE ALENCAR FELICIO","IDELANO FELICIO",8,1
"PEDRO RIBEIRO FILHO","PASTOR PEDRO RIBEIRO",7,1
"RAIMUNDO GOMES DE MATOS","RAIMUNDO GOMES DE MATOS",8,1
"RAMIRO BRAGA DE FREITAS","RAMIRO BRAGA",4,1
"RIBAMAR VIANA DA SILVA","RIBAMAR DO HOSPITAL",4,1
"ROBERTO OLIVEIRA BARROS","ROBERTO OLIVEIRA",8,1
"SILVIO VIEIRA DA SILVA","SILVIO VIEIRA",8,1
"SAMIA MARIA MENESES BRILHANTE","SÂMIA BRILHANTE",8,1
"VICENTE ANTENOR FERREIRA GOMES FILHO","DR VICENTE",8,1
"VICENTE FERREIRA DE ARRUDA COELHO","VICENTE ARRUDA",8,1
"ALAN DEAN FERREIRA TOURINHO","ALAN TOURINHO",4,1
"ALAN VIGGIANO","ALAN VIGGIANO",8,1
"ARISTON JOSE MORAIS LIMA","SD ARISTON LIMA",7,1
"AUGUSTO SILVEIRA DE CARVALHO","AUGUSTO CARVALHO",8,1
"AURELIO FEITOSA MATTOS FILHO","CORONEL FEITOSA",8,1
"CESAR AUGUSTO GONCALVES","CESAR GONÇALVES",8,1
"CHARLES DE MAGALHAES ARAUJO JUNIOR","MAJOR CHARLES",8,1
"CHRISTIAN PERILLIER SCHNEIDER","CHRISTIAN SCHNEIDER",8,1
"CLAUDIO PEREIRA SANTANA","CLAUDIO SANTANA",8,1
"CLERIA AUGUSTA DOS SANTOS","CLÉRIA SANTOS",8,1
"EDUARDO DUTRA BRANDAO CAVALCANTI","EDUARDO BRANDÃO",8,1
"EGMAR TAVARES DA SILVA","PASTOR EGMAR",6,1
"ELZA CARVALHO LOPES","ELZA LOPES",8,1
"ERI RODRIGUES VARELA","ERI VARELA",8,1
"FREDO EBLING JUNIOR","FREDO",8,1
"GEDALIAS NEVES DA COSTA","PASTOR GEDALIAS",8,1
"GERALDO MAGELA PEREIRA","MAGELA",6,1
"ISMAEL JOSE CESAR","ISMAEL",8,1
"IVONE ARMANDO LUZARDO DE SOUSA","IVONE LUZARDO",8,1
"IVONE FERNANDES CARNEIRO","IVONINHA",6,1
"IZALCI LUCAS FERREIRA","IZALCI",8,1
"JOFRAN FREJAT","JOFRAN FREJAT",8,1
"JOSE RUBENS BENTO","J. RUBENS",6,1
"JOSINA MARA DE MELO DE LIMA SANTOS XAVIER SILVA DOS ANJOS","MARA MELO",7,1
"JOSE EDMAR DE CASTRO CORDEIRO","ZÉ EDMAR",8,1
"JOSE PEREIRA LIMA","JOSÉ PEREIRA",6,1
"JOAO ALBERTO FRAGA SILVA","FRAGA",8,1
"JOAO DE DEUS SILVA CARVALHO","JOÃO DE DEUS",4,1
"LUIS CARLOS SIGMARINGA SEIXAS","SIGMARINGA",8,1
"LUIZ ANDRE RORIZ SOLANO","DEDÉ RORIZ",7,1
"LUIZ CLAUDIO FREIRE DE SOUZA FRANCA","LUIZ FRANÇA",8,1
"MARIA ADELIA SOARES CORREIA DOS SANTOS","MARIA ADÉLIA",7,1
"MARIA DO SOCORRO CRONEMBERGER COSTA GOMES","SOCORRO CRONEMBERGER",8,1
"MARIA INES FONTENELE MOURAO","MARIA INÊS",6,1
"MARIA LAURA SALES PINHEIRO","MARIA LAURA",8,1
"MILTON CINTRA E SILVA","CINTRA",8,1
"NAIR ALVES DE ANDRADE","PROFª NAIR",8,1
"NELSON TADEU FILIPPELLI","TADEU FILIPPELLI",8,1
"ODETINO PEREIRA DIAS","ODETINO",6,1
"OSORIO ADRIANO FILHO","OSÓRIO",8,1
"PAULO CARVALHO XAVIER","PAULO XAVIER",8,1
"PAULO CEZAR CASTANHEIRO COELHO","PAULO FONA",8,1
"PAULO FERNANDO RAMOS SEREJO","PAULO SEREJO",8,1
"PAULO VALERIO SILVA LIMA","PAULO VALÉRIO",8,1
"PEDRO MAURINO CALMON MENDES","PEDRO CALMON",8,1
"PEDRO RODRIGUES DE CARVALHO","CARVALHO",7,1
"RICARDO QUIRINO DOS SANTOS","RICARDO QUIRINO",6,1
"ROGERIO SCHUMANN ROSSO","ROGÉRIO ROSSO",8,1
"ROMILDA TEIXEIRA SHINTATE","ROMILDA TEIXEIRA",8,1
"ROSIDETE MARIA ROSA","ROSE ROSA",7,1
"SEBASTIAO AUGUSTO BUANI","BUANI",8,1
"WASNY NAKLE DE ROURE","WASNY",8,1
"WILMAR LACERDA","WILMAR LACERDA",8,1
"ALEXANDRE VALDO MAITAN","ALEXANDRE MAITAN",8,1
"ALMIR BRESSAN JUNIOR","ALMIR BRESSAN",8,1
"ALOIZIO SANTOS","ALOIZIO SANTOS",8,1
"ANA LUCIA CORDEIRO REZENDE","ANA LUCIA REZENDE",8,1
"ANTONIO OLIMPIO MAGALHAES","ANTONIO MAGALHAES",7,1
"ANTONIO STEIN NETO","TONINHO STEIN",6,1
"ANTONIO TEODORO DE MORAES","TONINHO MORAES",8,1
"ANTONIO VALTER GALLON","ANTONIO GALLON",6,1
"AROLDO PEREIRA DOS SANTOS","PASTOR AROLDO",6,1
"CAMILO COLA","CAMILO COLA",4,1
"CARLOS ALBERTO LIRYO","CARLINHOS LIRYO",6,1
"CARLOS AUGUSTO BRAGA GONDIM DUARTE","PROFESSOR CARLOS",8,1
"CARLOS AURELIO LINHALIS","CAEL",8,1
"CARLOS HUMBERTO MANNATO","MANATO",8,1
"ELIAS DE SOUZA","ELIAS DO PT",6,1
"ELISA CLAUDIA SANT'ANA LEITE","ELISA",8,1
"ERALDO CAVICCHINI MATOS","PADRE ERALDO",8,1
"FABIO AMBROZIO NASCIMENTO TRINDADE","FABINHO TRINDADE",8,1
"FABIO MENDES GLORIA","FABINHO GLÓRIA",7,1
"FLAVIO MOREIRA","PROFESSOR FLAVIO",8,1
"FRANCISCO TARCISIO SILVA","TARCISIO SILVA",8,1
"GENARIO JOSE DA MATA","GENÁRIO SANFONEIRO",8,1
"HELENA DA SILVA GUIMARAES","HELENA BRITO",5,1
"HENRIQUE ANGELO DENICOLI","HENRIQUE DENICOLI",8,1
"HUMBERTO SIMOES GONCALVES","DR. HUMBERTO",8,1
"HERCULES DANTAS DOS SANTOS","PASTOR HÉRCULES DANTAS",8,1
"IRINY NICOLAU CORRES LOPES","IRINY LOPES",6,1
"ITAMAR ALVES FREIRE","ITAMAR FREIRE",6,1
"IVAN CARLINI","IVAN CARLINI",6,1
"JANDER NUNES VIDAL","DR. JANDER / JANDER",8,1
"JATHIR GOMES MOREIRA","JATHIR MOREIRA",8,1
"JOAO BARBOZA VALADARES","SOLDADO JOAO VALADARES",6,1
"JOAO MIGUEL FEU ROSA","FEU ROSA",8,1
"JOAQUIM CAPISTRANO DE SOUZA","KINKAS",8,1
"JONES CAVAGLIERI","JONES CAVAGLIERI",6,1
"JONIMAR SANTOS OLIVEIRA","JONIMAR",6,1
"JORGE SILVA","DR. JORGE SILVA",8,1
"JOSE FRANCISCO TEIXEIRA DO AMARAL","DR. AMARAL",8,1
"JOSE CARLOS DA FONSECA JUNIOR","JOSÉ CARLOS FONSECA JÚNIOR",8,1
"JOSE CARLOS PIGATTI","PIGATTI",8,1
"JOSE MANSUR SILVA MALHAME","MANSUR",8,1
"JOSE ROBERTO CORREA DO NASCIMENTO","DUDÉ",6,1
"JOAO ARTEM","JOÃO ARTÉM",8,1
"JORIO DE BARROS CARNEIRO","JÓRIO DE BARROS",8,1
"LEDA HELOISA DA SILVA","LEDA HELOISA",4,1
